Id,ChapterId,Code,Name
D9B63004-ED63-4FA7-B495-86C5674362A8,9A5474C3-610F-4D80-90EE-4C287F018231,T08-T14,"Injuries to unspecified part of trunk, limb or body region"
5855F7CD-8854-496C-A8CF-255CCE90FA75,9A5474C3-610F-4D80-90EE-4C287F018231,T15-T19,"Effects of foreign body entering through natural orifice"
53F25E98-DC09-4A01-ACFC-D089F1C387E7,9A5474C3-610F-4D80-90EE-4C287F018231,T20-T25,"Burns and corrosions of external body surface, specified by site"
DB5AD378-4B0D-41C3-833E-8D01F4448B74,9A5474C3-610F-4D80-90EE-4C287F018231,T26-T28,"Burns and corrosions confined to eye and internal organs"
70559EA5-67EF-4668-9411-30DCCD5B53DE,9A5474C3-610F-4D80-90EE-4C287F018231,T29-T32,"Burns and corrosions of multiple and unspecified body regions"
E27A89D1-5E45-400B-95A9-84AFFE4BF51B,9A5474C3-610F-4D80-90EE-4C287F018231,T33-T35,"Frostbite"
64182503-3FE3-4C0C-9AD7-F71BB0BBCC23,9A5474C3-610F-4D80-90EE-4C287F018231,T36-T50,"Poisoning by drugs, medicaments and biological substances"
CA2BA9E4-7914-48EB-A929-1C0A623319C9,9A5474C3-610F-4D80-90EE-4C287F018231,T51-T65,"Toxic effects of substances chiefly nonmedicinal as to source"
9359AFE8-AE8D-4746-BDA5-783A6028F5D9,9A5474C3-610F-4D80-90EE-4C287F018231,T66-T78,"Other and unspecified effects of external causes"
1D90D8AC-8EDB-4BCC-B813-D666F86B3603,9A5474C3-610F-4D80-90EE-4C287F018231,T79-T79,"Certain early complications of trauma"
D13BA688-22E0-4DB3-B672-13EEB0D85D19,9A5474C3-610F-4D80-90EE-4C287F018231,T80-T88,"Complications of surgical and medical care, not elsewhere classified"
98D808E6-B8E4-4616-A613-CB50C41C17C0,9A5474C3-610F-4D80-90EE-4C287F018231,T90-T98,"Sequelae of injuries, of poisoning and of other consequences of external causes"
CE2C4FD6-18F4-4676-932D-6035D60F92E9,7060F878-99D0-4E9D-8CC3-528520B60390,V01-V09,"Pedestrian injured in transport accident"
617AA8CB-311C-4006-BBC4-2AEA8BA7B37E,7060F878-99D0-4E9D-8CC3-528520B60390,V10-V19,"Pedal cyclist injured in transport accident"
CE001071-A3C9-4C21-B450-22DED3249789,7060F878-99D0-4E9D-8CC3-528520B60390,V20-V29,"Motorcycle rider injured in transport accident"
0C1EE525-4E6F-48AA-A141-F05212877679,7060F878-99D0-4E9D-8CC3-528520B60390,V30-V39,"Occupant of three-wheeled motor vehicle injured in transport accident"
CB69838D-9B6F-4B40-9DB3-F033D49597A4,7060F878-99D0-4E9D-8CC3-528520B60390,V40-V49,"Car occupant injured in transport accident"
21400D13-C6B1-4290-91FE-2DA76CACDCDF,7060F878-99D0-4E9D-8CC3-528520B60390,V50-V59,"Occupant of pick-up truck or van injured in transport accident"
096E8342-173A-46B0-A2BE-5389F5DDEB6A,7060F878-99D0-4E9D-8CC3-528520B60390,V60-V69,"Occupant of heavy transport vehicle injured in transport accident"
6A78F51C-4E27-4CC9-8D7E-5091E357BB17,7060F878-99D0-4E9D-8CC3-528520B60390,V70-V79,"Bus occupant injured in transport accident"
A5C2E1C2-7588-4958-9AA2-9DE96521C169,7060F878-99D0-4E9D-8CC3-528520B60390,V80-V89,"Other land transport accidents"
A0D798DD-D8DA-467E-89D6-47FE6C459412,7060F878-99D0-4E9D-8CC3-528520B60390,V90-V94,"Water transport accidents"
BEB900A4-74CD-4364-8FBF-5AB7F419F3C2,7060F878-99D0-4E9D-8CC3-528520B60390,V95-V97,"Air and space transport accidents"
D31E8EF1-6D07-48FE-B628-6829F655482F,7060F878-99D0-4E9D-8CC3-528520B60390,V98-V99,"Other and unspecified transport accidents"
53C50F1E-63AF-40E0-85F9-37033DF19C10,7060F878-99D0-4E9D-8CC3-528520B60390,W00-W19,"Falls"
F3D9D350-104F-4879-A9A0-4C70C68FC4F6,7060F878-99D0-4E9D-8CC3-528520B60390,W20-W49,"Exposure to inanimate mechanical forces"
4D990610-F5BD-4EC8-AC30-101E0F4A5958,7060F878-99D0-4E9D-8CC3-528520B60390,W50-W64,"Exposure to animate mechanical forces"
E8D9C2A8-94AE-4738-A0FD-5BBBA81680AD,7060F878-99D0-4E9D-8CC3-528520B60390,W65-W74,"Accidental drowning and submersion"
EB114501-C204-4BB3-B43F-71080C1503AC,7060F878-99D0-4E9D-8CC3-528520B60390,W75-W84,"Other accidental threats to breathing"
3E229022-C5DD-4F4C-AB59-F1E84130BCEB,7060F878-99D0-4E9D-8CC3-528520B60390,W85-W99,"Exposure to electric current, radiation and extreme ambient air temperature and pressure"
9C6D3FEB-F347-4970-8553-AB8616596FCB,7060F878-99D0-4E9D-8CC3-528520B60390,X00-X09,"Exposure to smoke, fire and flames"
CA6963CF-864F-47E0-A50B-31DCCD3FE5C7,7060F878-99D0-4E9D-8CC3-528520B60390,X10-X19,"Contact with heat and hot substances"
BB13170B-2241-4390-91D6-ED44601E55AC,7060F878-99D0-4E9D-8CC3-528520B60390,X20-X29,"Contact with venomous animals and plants"
ED462D0F-5E5B-4D72-8A39-0B2222EF35E4,7060F878-99D0-4E9D-8CC3-528520B60390,X30-X39,"Exposure to forces of nature"
E9662078-89A2-4339-A56C-CAD0A93AFC30,7060F878-99D0-4E9D-8CC3-528520B60390,X40-X49,"Accidental poisoning by and exposure to noxious substances"
5C95C229-B98C-4BC5-B648-F650DF8D0EDE,7060F878-99D0-4E9D-8CC3-528520B60390,X50-X57,"Overexertion, travel and privation"
8C820139-FB71-433D-9AB9-7CB0EBECF574,7060F878-99D0-4E9D-8CC3-528520B60390,X58-X59,"Accidental exposure to other and unspecified factors"
27C033D3-8B48-4DCF-B159-19BFA700EEA9,7060F878-99D0-4E9D-8CC3-528520B60390,X60-X84,"Intentional self-harm"
800AB7A0-7566-4F46-A681-8C6A739A539D,7060F878-99D0-4E9D-8CC3-528520B60390,X85-Y09,"Assault"
5833CDC9-AF4C-47C6-9E47-3885D6EF6CCB,7060F878-99D0-4E9D-8CC3-528520B60390,Y10-Y34,"Event of undetermined intent"
4F2B18B8-6FC0-4CF2-A256-509E46AF37FF,7060F878-99D0-4E9D-8CC3-528520B60390,Y35-Y36,"Legal intervention and operations of war"
BFB194FA-76DF-4310-BE0C-91F7589F9E36,7060F878-99D0-4E9D-8CC3-528520B60390,Y40-Y59,"Drugs, medicaments and biological substances causing adverse effects in therapeutic use"
C0FB55DF-665A-4C45-92F9-1ED48280ECC1,7060F878-99D0-4E9D-8CC3-528520B60390,Y60-Y69,"Misadventures to patients during surgical and medical care"
D5CD48CB-7C01-471D-BAD1-360089EE19F9,7060F878-99D0-4E9D-8CC3-528520B60390,Y70-Y82,"Medical devices associated with adverse incidents in diagnostic and therapeutic use"
A6F7A6CF-35ED-4F58-B696-154E2F248C08,7060F878-99D0-4E9D-8CC3-528520B60390,Y83-Y84,"Surgical and other medical procedures as the cause of abnormal reaction of the patient, or of later complication, without mention of misadventure at the time of the procedure"
C6995E25-4E4F-4163-9C13-DF55C7097C43,7060F878-99D0-4E9D-8CC3-528520B60390,Y85-Y89,"Sequelae of external causes of morbidity and mortality"
237BCD32-D452-4B1F-84CD-B0852A82B932,7060F878-99D0-4E9D-8CC3-528520B60390,Y90-Y98,"Supplementary factors related to causes of morbidity and mortality classified elsewhere"
9E4590D2-4803-4D49-B252-740E85DAB443,18409F09-D21B-4346-AC52-DF08DEE89CA2,Z00-Z13,"Persons encountering health services for examination and investigation"
764EDE11-7DF0-4463-86D9-6A30E8ABA82A,18409F09-D21B-4346-AC52-DF08DEE89CA2,Z20-Z29,"Persons with potential health hazards related to communicable diseases"
AC70ED47-7EF4-4191-89AA-2557D81CFF44,18409F09-D21B-4346-AC52-DF08DEE89CA2,Z30-Z39,"Persons encountering health services in circumstances related to reproduction"
010D0B56-BFD0-43B2-83A5-CBF5AE85B9B0,18409F09-D21B-4346-AC52-DF08DEE89CA2,Z40-Z54,"Persons encountering health services for specific procedures and health care"
A6476843-EB2F-4196-A1CF-2EF5CF32156F,18409F09-D21B-4346-AC52-DF08DEE89CA2,Z55-Z65,"Persons with potential health hazards related to socioeconomic and psychosocial circumstances"
FDF24BA9-FF02-42D3-B76F-6F22B70A4AAD,18409F09-D21B-4346-AC52-DF08DEE89CA2,Z70-Z76,"Persons encountering health services in other circumstances"
F08C4FE7-1C1C-451E-A190-C4E8D21CF5FD,18409F09-D21B-4346-AC52-DF08DEE89CA2,Z80-Z99,"Persons with potential health hazards related to family and personal history and certain conditions influencing health status"
C52AEA01-A198-44BC-AF95-DA5A74517686,8D695CC8-2A99-4DDF-9306-48C66A0FDBA0,U00-U49,"Provisional assignment of new diseases of uncertain etiology"
D07539D3-ABD3-48FD-AC8E-4EE434366406,8D695CC8-2A99-4DDF-9306-48C66A0FDBA0,U80-U89,"Bacterial agents resistant to antibiotics"